{
  "schema_version": 1,
  "review_id": "REVIEW-1",
  "task_id": "TASK-1",
  "attempt_id": "ATTEMPT-1",
  "plan_version": 1,
  "contract_revision": 1,
  "artifact_hash": "sha256:aaaaaaaaaaaaaaaaaaaaaaaaaaaaaaaaaaaaaaaaaaaaaaaaaaaaaaaaaaaaaaaa",
  "verdict": "needs_revision",
  "findings": [
    {
      "id": "F-1",
      "basis_id": "AC-1",
      "severity": "blocking",
      "status": "open",
      "problem": "仅重试一次",
      "evidence_ref": "VERIFY-1:retry",
      "required_fix": "按已确认要求重试两次",
      "recheck": "retry"
    }
  ],
  "suggestions": [
    {
      "id": "S-1",
      "text": "后续可以讨论新的展示方式",
      "blocks_delivery": false
    }
  ]
}
